{
    "task_id": "TASK-0001",
    "work_item_revision": 1,
    "subject_base_commit": "3c86b5335d531b662e127bb5da6d8b442bf75af0",
    "subject_head_commit": "7e10dae772c07c03c29ea122d4e80a1e18d31262",
    "subject_diff_hash": "f8da6ed86a18043f59f80383eefe6a376b14103658d1f1afa1e0aa4e8b52237a",
    "summary": "新增 docs/USAGE.md 完整中文使用说明书，并在 README 增加入口；覆盖接入、提需求前准备、需求模板、生命周期、R0/R1/R2、独立 Review、恢复、升级和故障排查。R0 Review 接受，AC-01 至 AC-07 全部验证通过，完整测试 22/22 PASS。"
}
