{
    "task_id": "TASK-0001",
    "work_item_revision": 1,
    "subject_base_commit": "0000000000000000000000000000000000000000",
    "subject_head_commit": "0000000000000000000000000000000000000000",
    "subject_diff_hash": "0000000000000000000000000000000000000000000000000000000000000000",
    "summary": "TODO"
}
